{
  "$schema": "./recipe-display.schema.json",
  "schema": "recipe-display-spec",
  "version": 2,
  "tables": {
    "tier_name": {
      "0": "spec.gregtech.table.tier_name.k_0",
      "1": "spec.gregtech.table.tier_name.k_1",
      "2": "spec.gregtech.table.tier_name.k_2",
      "3": "spec.gregtech.table.tier_name.k_3",
      "4": "spec.gregtech.table.tier_name.k_4",
      "5": "spec.gregtech.table.tier_name.k_5",
      "6": "spec.gregtech.table.tier_name.k_6",
      "7": "spec.gregtech.table.tier_name.k_7",
      "8": "spec.gregtech.table.tier_name.k_8",
      "9": "spec.gregtech.table.tier_name.k_9",
      "10": "spec.gregtech.table.tier_name.k_10",
      "11": "spec.gregtech.table.tier_name.k_11",
      "12": "spec.gregtech.table.tier_name.k_12",
      "13": "spec.gregtech.table.tier_name.k_13",
      "14": "spec.gregtech.table.tier_name.k_14"
    },
    "coil_material": {
      "1801": "spec.gregtech.table.coil_material.k_1801",
      "2701": "spec.gregtech.table.coil_material.k_2701",
      "3601": "spec.gregtech.table.coil_material.k_3601",
      "4501": "spec.gregtech.table.coil_material.k_4501",
      "5401": "spec.gregtech.table.coil_material.k_5401",
      "6301": "spec.gregtech.table.coil_material.k_6301",
      "7201": "spec.gregtech.table.coil_material.k_7201",
      "8101": "spec.gregtech.table.coil_material.k_8101",
      "9001": "spec.gregtech.table.coil_material.k_9001",
      "9901": "spec.gregtech.table.coil_material.k_9901",
      "10801": "spec.gregtech.table.coil_material.k_10801",
      "11701": "spec.gregtech.table.coil_material.k_11701",
      "12601": "spec.gregtech.table.coil_material.k_12601",
      "13501": "spec.gregtech.table.coil_material.k_13501",
      "*": "spec.gregtech.table.coil_material.star"
    },
    "chemplant_casing": {
      "0": "spec.gregtech.table.chemplant_casing.k_0",
      "1": "spec.gregtech.table.chemplant_casing.k_1",
      "2": "spec.gregtech.table.chemplant_casing.k_2",
      "3": "spec.gregtech.table.chemplant_casing.k_3",
      "4": "spec.gregtech.table.chemplant_casing.k_4",
      "5": "spec.gregtech.table.chemplant_casing.k_5",
      "6": "spec.gregtech.table.chemplant_casing.k_6",
      "7": "spec.gregtech.table.chemplant_casing.k_7"
    },
    "eoh_spacetime_fancy": {
      "0": "spec.gregtech.table.eoh_spacetime_fancy.k_0",
      "1": "spec.gregtech.table.eoh_spacetime_fancy.k_1",
      "2": "spec.gregtech.table.eoh_spacetime_fancy.k_2",
      "3": "spec.gregtech.table.eoh_spacetime_fancy.k_3",
      "4": "spec.gregtech.table.eoh_spacetime_fancy.k_4",
      "5": "spec.gregtech.table.eoh_spacetime_fancy.k_5",
      "6": "spec.gregtech.table.eoh_spacetime_fancy.k_6",
      "7": "spec.gregtech.table.eoh_spacetime_fancy.k_7",
      "8": "spec.gregtech.table.eoh_spacetime_fancy.k_8"
    },
    "decay_type": {
      "Unknown": "spec.gregtech.table.decay_type.Unknown",
      "Alpha": "spec.gregtech.table.decay_type.Alpha",
      "SpontaneousFission": "spec.gregtech.table.decay_type.SpontaneousFission",
      "Cluster": "spec.gregtech.table.decay_type.Cluster",
      "AlphaTransfer": "spec.gregtech.table.decay_type.AlphaTransfer",
      "BetaMinus": "spec.gregtech.table.decay_type.BetaMinus",
      "BetaPlus": "spec.gregtech.table.decay_type.BetaPlus"
    },
    "ig_planet": {
      "planet.jupiter": "spec.gregtech.table.ig_planet.jupiter",
      "planet.saturn": "spec.gregtech.table.ig_planet.saturn",
      "planet.uranus": "spec.gregtech.table.ig_planet.uranus",
      "planet.neptune": "spec.gregtech.table.ig_planet.neptune"
    }
  },
  "handlers": {
    "tic_bolt_molding": {
      "recipe_kind": "PROCESSING",
      "recipe_count": 27367,
      "lines": [
        {
          "kind": "total_eu",
          "format": "comma_long",
          "labelKey": "spec.gregtech.handler.tic_bolt_molding.line.l0.label",
          "suffixKey": "spec.gregtech.handler.tic_bolt_molding.line.l0.suffix"
        },
        {
          "kind": "voltage_block",
          "single": {
            "expr": "comma(ctx.voltage)",
            "labelKey": "spec.gregtech.handler.tic_bolt_molding.line.l1.single.label",
            "valueTemplateKey": "spec.gregtech.template.voltageWithTier",
            "templateArgs": {
              "tier": "ctx.voltage_tier"
            }
          }
        },
        {
          "kind": "duration",
          "format": "duration_seconds",
          "labelKey": "spec.gregtech.handler.tic_bolt_molding.line.l2.label"
        }
      ],
      "nameKey": "spec.gregtech.handler.tic_bolt_molding.name"
    },
    "assembler": {
      "recipe_kind": "PROCESSING",
      "recipe_count": 13233,
      "lines": [
        {
          "kind": "total_eu",
          "format": "comma_long",
          "labelKey": "spec.gregtech.handler.assembler.line.l0.label",
          "suffixKey": "spec.gregtech.handler.assembler.line.l0.suffix"
        },
        {
          "kind": "voltage_block",
          "single": {
            "expr": "comma(ctx.voltage)",
            "labelKey": "spec.gregtech.handler.assembler.line.l1.single.label",
            "valueTemplateKey": "spec.gregtech.template.voltageWithTier",
            "templateArgs": {
              "tier": "ctx.voltage_tier"
            }
          }
        },
        {
          "kind": "duration",
          "format": "duration_seconds",
          "labelKey": "spec.gregtech.handler.assembler.line.l2.label"
        },
        {
          "kind": "flag",
          "key": "cleanroom",
          "show_if_true": true,
          "labelKey": null,
          "literalKey": "spec.gregtech.handler.assembler.line.l3.literal"
        }
      ],
      "nameKey": "spec.gregtech.handler.assembler.name"
    },
    "macerator_recycling": {
      "recipe_kind": "PROCESSING",
      "recipe_count": 11064,
      "lines": [
        {
          "kind": "total_eu",
          "format": "comma_long",
          "labelKey": "spec.gregtech.handler.macerator_recycling.line.l0.label",
          "suffixKey": "spec.gregtech.handler.macerator_recycling.line.l0.suffix"
        },
        {
          "kind": "voltage_block",
          "single": {
            "expr": "comma(ctx.voltage)",
            "labelKey": "spec.gregtech.handler.macerator_recycling.line.l1.single.label",
            "valueTemplateKey": "spec.gregtech.template.voltageWithTier",
            "templateArgs": {
              "tier": "ctx.voltage_tier"
            }
          }
        },
        {
          "kind": "duration",
          "format": "duration_seconds",
          "labelKey": "spec.gregtech.handler.macerator_recycling.line.l2.label"
        }
      ],
      "nameKey": "spec.gregtech.handler.macerator_recycling.name"
    },
    "fluidextractor_recycling": {
      "recipe_kind": "PROCESSING",
      "recipe_count": 8983,
      "lines": [
        {
          "kind": "total_eu",
          "format": "comma_long",
          "labelKey": "spec.gregtech.handler.fluidextractor_recycling.line.l0.label",
          "suffixKey": "spec.gregtech.handler.fluidextractor_recycling.line.l0.suffix"
        },
        {
          "kind": "voltage_block",
          "single": {
            "expr": "comma(ctx.voltage)",
            "labelKey": "spec.gregtech.handler.fluidextractor_recycling.line.l1.single.label",
            "valueTemplateKey": "spec.gregtech.template.voltageWithTier",
            "templateArgs": {
              "tier": "ctx.voltage_tier"
            }
          }
        },
        {
          "kind": "duration",
          "format": "duration_seconds",
          "labelKey": "spec.gregtech.handler.fluidextractor_recycling.line.l2.label"
        }
      ],
      "nameKey": "spec.gregtech.handler.fluidextractor_recycling.name"
    },
    "tic_part_extruding": {
      "recipe_kind": "PROCESSING",
      "recipe_count": 8825,
      "lines": [
        {
          "kind": "total_eu",
          "format": "comma_long",
          "labelKey": "spec.gregtech.handler.tic_part_extruding.line.l0.label",
          "suffixKey": "spec.gregtech.handler.tic_part_extruding.line.l0.suffix"
        },
        {
          "kind": "voltage_block",
          "single": {
            "expr": "comma(ctx.voltage)",
            "labelKey": "spec.gregtech.handler.tic_part_extruding.line.l1.single.label",
            "valueTemplateKey": "spec.gregtech.template.voltageWithTier",
            "templateArgs": {
              "tier": "ctx.voltage_tier"
            }
          }
        },
        {
          "kind": "duration",
          "format": "duration_seconds",
          "labelKey": "spec.gregtech.handler.tic_part_extruding.line.l2.label"
        }
      ],
      "nameKey": "spec.gregtech.handler.tic_part_extruding.name"
    },
    "alloysmelter_recycling": {
      "recipe_kind": "PROCESSING",
      "recipe_count": 8515,
      "lines": [
        {
          "kind": "total_eu",
          "format": "comma_long",
          "labelKey": "spec.gregtech.handler.alloysmelter_recycling.line.l0.label",
          "suffixKey": "spec.gregtech.handler.alloysmelter_recycling.line.l0.suffix"
        },
        {
          "kind": "voltage_block",
          "single": {
            "expr": "comma(ctx.voltage)",
            "labelKey": "spec.gregtech.handler.alloysmelter_recycling.line.l1.single.label",
            "valueTemplateKey": "spec.gregtech.template.voltageWithTier",
            "templateArgs": {
              "tier": "ctx.voltage_tier"
            }
          }
        },
        {
          "kind": "duration",
          "format": "duration_seconds",
          "labelKey": "spec.gregtech.handler.alloysmelter_recycling.line.l2.label"
        }
      ],
      "nameKey": "spec.gregtech.handler.alloysmelter_recycling.name"
    },
    "arcfurnace_recycling": {
      "recipe_kind": "PROCESSING",
      "recipe_count": 8349,
      "lines": [
        {
          "kind": "total_eu",
          "format": "comma_long",
          "labelKey": "spec.gregtech.handler.arcfurnace_recycling.line.l0.label",